{
  "version": "2",
  "snapshot_id": "sha256:0000000000000000000000000000000000000000000000000000000000000000",
  "corpus_version_id": "sha256:0000000000000000000000000000000000000000000000000000000000000000",
  "candidate_bundle_id": "x",
  "candidate": {
    "id": "x",
    "model": "x",
    "source": "imported"
  },
  "case_verdicts": [],
  "summary": {
    "total_cases": 0,
    "pass_count": 0,
    "fail_count": 0,
    "abstain_count": 0,
    "coverage": 0
  },
  "cost": {
    "candidate_cost_usd": 0,
    "evaluation_cost_usd": 0,
    "total_cost_usd": 0
  },
  "timing": {
    "availability": "available",
    "available_case_count": 0,
    "missing_case_count": 0
  },
  "evidence": {
    "available_case_count": 0,
    "missing_case_count": 0,
    "references": []
  },
  "scorecards": {
    "safety": {
      "value": null,
      "numerator": 0,
      "denominator": 0,
      "threshold": null,
      "status": "unavailable",
      "population": "census",
      "generalization": "corpus_only",
      "ci_low": null,
      "ci_high": null,
      "ci_method": null,
      "alpha": null,
      "evidence_refs": [],
      "details": {}
    },
    "quality": {
      "overall": {
        "value": null,
        "numerator": 0,
        "denominator": 0,
        "threshold": null,
        "status": "unavailable",
        "population": "census",
        "generalization": "corpus_only",
        "ci_low": null,
        "ci_high": null,
        "ci_method": "wilson",
        "alpha": 0.05,
        "evidence_refs": [],
        "details": {}
      },
      "by_family": {}
    },
    "recommendation_precision": {
      "value": null,
      "numerator": 0,
      "denominator": 0,
      "threshold": null,
      "status": "unavailable",
      "population": "census",
      "generalization": "corpus_only",
      "ci_low": null,
      "ci_high": null,
      "ci_method": "wilson",
      "alpha": 0.05,
      "evidence_refs": [],
      "details": {}
    },
    "safe_opportunity_recall": {
      "value": null,
      "numerator": 0,
      "denominator": 0,
      "threshold": null,
      "status": "unavailable",
      "population": "census",
      "generalization": "corpus_only",
      "ci_low": null,
      "ci_high": null,
      "ci_method": "wilson",
      "alpha": 0.05,
      "evidence_refs": [],
      "details": {}
    },
    "required_abstention": {
      "value": null,
      "numerator": 0,
      "denominator": 0,
      "threshold": null,
      "status": "unavailable",
      "population": "census",
      "generalization": "corpus_only",
      "ci_low": null,
      "ci_high": null,
      "ci_method": "wilson",
      "alpha": 0.05,
      "evidence_refs": [],
      "details": {}
    },
    "coverage": {
      "value": null,
      "numerator": 0,
      "denominator": 0,
      "threshold": null,
      "status": "unavailable",
      "population": "census",
      "generalization": "corpus_only",
      "ci_low": null,
      "ci_high": null,
      "ci_method": "wilson",
      "alpha": 0.05,
      "evidence_refs": [],
      "details": {}
    },
    "speed": {
      "value": null,
      "numerator": 0,
      "denominator": 0,
      "threshold": null,
      "status": "unavailable",
      "population": "census",
      "generalization": "corpus_only",
      "ci_low": null,
      "ci_high": null,
      "ci_method": null,
      "alpha": null,
      "evidence_refs": [],
      "details": {}
    },
    "confidence": {
      "level": "abstain",
      "status": "unavailable",
      "sample_count": 0,
      "pass_rate": null,
      "evidence_refs": []
    },
    "horizon_diagnostic": {
      "label": "compounded-end-to-end-pass-rate",
      "status": "unavailable",
      "diagnostic_only": true,
      "trajectory_length": null,
      "per_step_pass_rate": null,
      "end_to_end_pass_rate": null,
      "ci_low": null,
      "ci_high": null,
      "ci_method": null,
      "alpha": null,
      "generalization": "corpus_only",
      "assumptions_violated": true,
      "assumptions": [
        "constant per-step accuracy",
        "independent steps",
        "no self-correction"
      ],
      "evidence_refs": [],
      "reason": "trajectory length is not present in the corpus"
    },
    "remediation": {
      "value": null,
      "numerator": 0,
      "denominator": 0,
      "threshold": null,
      "status": "unavailable",
      "population": "census",
      "generalization": "corpus_only",
      "ci_low": null,
      "ci_high": null,
      "ci_method": null,
      "alpha": null,
      "evidence_refs": [],
      "details": {}
    },
    "cost": {
      "value": null,
      "numerator": 0,
      "denominator": 0,
      "threshold": null,
      "status": "unavailable",
      "population": "census",
      "generalization": "corpus_only",
      "ci_low": null,
      "ci_high": null,
      "ci_method": null,
      "alpha": null,
      "evidence_refs": [],
      "details": {}
    }
  },
  "gates": []
}
